PoleStudio_Name,Adresse,PLZ,Stadt,Straße,Buttons,Pole Studio Beschreibung,Ratingscore,Reviewanzahl,Rating Faktoren,E-Mail,Homepage,Telefon,URL_S,Art,Angebot,Bildergalerie,Created Date,Updated Date
Stadtgazellen Bremen,"['Bremerhavener Straße 210 ', ' 28217 Bremen']",28217,Bremen,Bremerhavener Straße 210 ,"['Übersicht', 'Klassen', 'Workshops', 'Preise', 'Team']","Dein Studio für Poledance und Luftakrobatik in Bremen! In unserem wunderschönen Studio mit Loftcharakter bieten wir euch Pole Dance und Aerial Fitness Kurse auf höchstem Niveau. Unsere professionell ausgebildeten Trainer unterrichten euch in Kleingruppen um ein gesundheitsorientiertes, qualitativ hochwertiges Fitness- und Tanztraining mit viel Spaß zu bieten. Jedem Teilnehmer steht ein eigenes Luftakrobatikgerät zur Verfügung. Auf 300qm Fläche findet ihr zwei Kursräume und einen großzügigen Umkleidebereich mit Kaffeeküche und Lounge. Ausreichend kostenlose Parkplätze stehen euch um das Studio herum zur Verfügung.","4,9",85 Rezensionen,"['Raumqualität: 5.0', 'Freundlichkeit & Service: 5.0', 'Sauberkeit: 5.0', 'Atmosphäre: 5.0', 'Preis-Leistung: 4.7']", info@poledance-bremen.de,http://www.poledance-bremen.de,+4915154033605,https://www.eversports.de/s/stadtgazellen-bremen,"['Aerial Yoga', 'Poledance', 'Poledance', 'Stretching', 'Poledance', 'Aerial Hoop', 'Poledance', 'Stretching', 'Aerial Silk', 'Aerial Akrobatik', '85 Rezensionen', 'Poledance', 'Aerial Yoga', 'Stretching', 'Aerial Silk', 'Aerial Hoop', 'Aerial Akrobatik', 'Online Klasse']",1 Angebot für Neukund:innen,"['https://files.eversports.com/50e0328f-0b23-4c41-bde0-9f57f0d50759/foto-311019-13-12-24-1jpg-x-large.webp', 'https://files.eversports.com/c9487871-491e-4a4e-b749-368eaf08de0f/ab6a5903jpg-small.webp']",2023-12-23 17:08:47,2023-12-23 17:08:47
Polestructions,"['Auguststraße 8', ' 53229 Bonn']",53229,Bonn,Auguststraße 8,"['Übersicht', 'Klassen', 'Videos', 'Preise', 'Team']","Polestructions ist ein Poledance Studio in Bonn. Hier findest Du Kurse in Pole Fitness und Luftakrobatik (Aerial Silk und Aerial Hoop). Weitere Kurse im vielfältigen Angebot sind Stretch & Contortion, Floorwork, Chair Dance, Acroyoga und Jumping. Interessiert? Für 10 Euro kannst du jederzeit eine Probestunde in der Auguststraße in Bonn-Beuel besuchen. Bei Polestructions gibt es auch regelmäßig dreistündige Workshops, damit sich eine längere Anfahrt lohnt.","4,9",162 Rezensionen,"['Raumqualität: 5.0', 'Freundlichkeit & Service: 5.0', 'Sauberkeit: 4.9', 'Atmosphäre: 5.0', 'Preis-Leistung: 4.8']", info@polestructions.com,https://polestructions.com/,+49 178 605 80 30,https://www.eversports.de/s/polestructions,"['Tanzen', 'Funsport', 'Fitness', 'Salsa', 'Tanzen', 'Salsa', 'Fitness', 'Tanzen', 'Fitness', 'Tanzen', '162 Rezensionen', 'Fitness', 'Tanzen', 'Poledance', 'Funsport', 'Personal Training', 'Flexibles Training', 'Gruppenangebote', 'Events', 'Akrobatik', 'Umkleidekabine', 'Tagestarife', 'Raumvermietung', 'Floorwork', 'Chairdance', 'Aerial Silk', 'Aerial Dance', 'Aerial Hoop', 'Aerial Akrobatik']",1 Angebot für Neukund:innen,"['https://files.eversports.com/18242dc3-f36f-4481-b3e8-46af81f3a64a/dsc_1123jpg-x-large.webp', 'https://files.eversports.com/41fba9d1-7047-4627-845a-9242ffa5f1a6/polestructions-de-70337-eversports-4jpg-small.webp', 'https://files.eversports.com/4fc2b9ba-1586-4d43-9937-c26accbf600b/polestructions-de-70337-eversports-5jpg-small.webp', 'https://files.eversports.com/edcc8294-18fd-4f40-86b8-43d01078e4dc/polestructions-de-70337-eversports-6jpg-small.webp', 'https://files.eversports.com/c3f72101-616e-4038-8200-cabcebe6429b/polestructions-de-70337-eversports-11jpg-small.webp']",2023-12-23 17:10:20,2023-12-23 17:10:20
Polemotions Filderstadt,"['Tübinger Straße 10 ', ' 70794 Filderstadt']",70794,Filderstadt,Tübinger Straße 10 ,"['Übersicht', 'Klassen', 'Preise', 'Team']","Komm vorbei und lerne zu fliegen!Bei Polemotions erwartet Dich mehr als wunderschöne Luftakrobatik. Wir sind eine Community voller unterschiedlicher Menschen, die alle nichts lieber tun als gemeinsam durchs Studio zu fliegen - aber jede:r auf seine eigene Art.Wir lieben alle Facetten und Stile von Pole Dance. Du willst etwas Neues versuchen, dich mehr bewegen, abschalten, etwas Besonderes ausprobieren, auf der Bühne stehen, tanzen und die Welt um dich vergessen, selbstbewusster werden und eine neue Seite von dir entdecken? Egal, was dein Grund ist zu uns ins Studio zu kommen - jeder Grund ist der richtige um Pole Dance anzufangen und wir freuen uns auf Dich!Werde Teil unserer Polemotions Family und lass dich von unserem Luftakrobatik-Fieber anstecken.","4,8",43 Rezensionen,"['Raumqualität: 4.6', 'Freundlichkeit & Service: 5.0', 'Sauberkeit: 4.9', 'Atmosphäre: 4.9', 'Preis-Leistung: 4.7']", info@polemotions.de,https://polemotions.de/,,https://www.eversports.de/s/polemotions-filderstadt,"['Poledance', 'Poledance', 'Krafttraining', 'Handstand', 'Handstand', 'Poledance', 'Poledance', '43 Rezensionen', 'Poledance', 'Krafttraining', 'Stretching', 'Handstand', 'Heels', 'Online Klasse']",1 Angebot für Neukund:innen,"['https://files.eversports.com/de88c9ad-d060-4f5d-bcbc-0ca322455816/img_20170329_232320_523-x-large.webp', 'https://files.eversports.com/6e71820d-88d0-43c3-a695-daa22eaef863/_22b9311jpg-small.webp', 'https://files.eversports.com/2b4769c7-e666-4fe0-8e5e-cd76f612d417/20170207_181111-small.webp', 'https://files.eversports.com/0bdc1528-9c7e-44f0-89a9-8428624dc16f/albina-fijpeg-small.webp', 'https://files.eversports.com/f7b8a8b4-5b26-4620-87f5-15076fe81e66/lkh_2881jpg-small.webp']",2023-12-23 17:12:36,2023-12-23 17:12:36
Polefly Academy,"['Bürgermeister-Wegele-Straße 6A ', ' 86167 Augsburg']",86167,Augsburg,Bürgermeister-Wegele-Straße 6A ,"['Übersicht', 'Klassen', 'Preise', 'Team']","Polefly Academy - dein ""place to be"" in Augsburg, wo du die Schwerkraft tanzend überwinden wirst.Wir bieten Pole Dance Stunden an und fokussieren uns dabei auf den tänzerischen Stil. Bei uns trainierst du in den Leveln Anfänger, Mittelstufe und Fortgeschrittenen in einer festen Gruppe und wir lernen gemeinsam Choreographien, die mit der Zeit immer anspruchsvoller werden. Ebenso bieten wir Spezialkurse (z.B. Floorwork und Exotic), Workshops und Junggesellinnenabschiede an. Auch abseits der Pole wirst du bei uns sicherlich fündig. Unser Kursangebot aus den Bereichen Yoga, Stretching und Fitness wird stetig erweitert. Komm gerne vorbei, wir freuen uns :-)",5,2 Rezensionen,"['Raumqualität: 5.0', 'Freundlichkeit & Service: 5.0', 'Sauberkeit: 5.0', 'Atmosphäre: 5.0', 'Preis-Leistung: 5.0']", office@polefly-academy.de,,,https://www.eversports.de/s/polefly-academy,"['Poledance', 'Stretching', 'Power Pole', 'Chairdance', 'Poledance', 'Chairdance', 'Power Pole', 'Poledance', '2 Rezensionen', 'Poledance', 'Power Pole', 'Stretching', 'Chairdance', 'Vinyasa Yoga', 'Aerial Dance', 'Polesport', 'Workout', 'Fitness und Yoga', 'Exotic']",Zum Stundenplan,"['https://files.eversports.com/3fe56e2b-bd59-44bc-b551-5d6a5f6ab459/teamjpg-x-large.webp', 'https://files.eversports.com/f95555f1-8ab2-42f8-9f45-87e357564cd7/thumbnail-4jpg-small.webp']",2023-12-23 17:13:01,2023-12-23 17:13:01
Seemannsbraut Poledance,"['Ochsenweg 27-29 ', ' 24941 Flensburg']",24941,Flensburg,Ochsenweg 27-29 ,"['Übersicht', 'Klassen', 'Workshops', 'Preise', 'Team']","Moin und willkommen an Bord in unserem Poledance Studio Seemannsbraut.Auf 200qm kannst du dich in unserem maritimen Studio so richtig auspowern und mit viel Freude deinem Hobby nachgehen. Hier findest du alles, was dein Tänzerherz sich wünscht.Aufgeteilt in 2 Trainingsräumen bieten wir dir neben 9 Poledance Stangen auch Aerial Silk, Aerial Hoop und viele andere Kurse an, die dich zum schwitzen bringen und bei denen du mit viel Spaß deine Flexibilität verbessern, sowie deine Kondition und Kraft aufbauen kannst.Polesport, Klimmzugstangen, Sprossenwände, Gewichte, Yoga und viele andere Kurse mit unserer tollen Trainercrew warten auf dich.Unsere qualifizierten Trainer stehen dir jederzeit mit Rat und Tat zur Seite und helfen dir, dich stetig zu verbessern und Erfolgserlebnisse zu erzielen.In unserer maritimen Lounge kannst du Getränke und Snacks zu dir nehmen und in unserem Shop stöbern.Für dich stehen 2 Umkleiden und sanitäre Anlagen bereit.Schau mal rein und werde ein Teil der Seemannsbraut- Familie. Egal ob Mann, Frau oder Divers, bei uns an Bord ist jeder willkommen. Auch das Alter spielt keine Rolle.Wir freuen uns auf dich!Komm an Bord.Unsere Mitgliedschaften kannst du vor Ort im Studio abschließen oder schreibe uns eine mail. Mit den ALL Inclusive Mitgliedschaften kannst du alle Angebote unbegrenzt buchen.Alternativ haben wir auch ALL Inclusive 10-er Karten für dich.","4,9",35 Rezensionen,"['Raumqualität: 4.9', 'Freundlichkeit & Service: 4.9', 'Sauberkeit: 5.0', 'Atmosphäre: 4.9', 'Preis-Leistung: 4.8']", seemannsbraut-poledance@web.de,http://www.seemannsbraut-poledance.de,,https://www.eversports.de/s/seemannsbraut-poledance,"['Yoga', 'Poledance', 'Poledance', 'Polesport', 'Poledance', 'HIIT', 'Poledance', 'Poledance', 'Tanzen', 'Funktionelles Training', 'HIIT', '35 Rezensionen', 'Tanzen', 'Yoga', 'Poledance', 'Funktionelles Training', 'Kangoo Jumps', 'HIIT', 'Stretching', 'Lapdance', 'Chairdance', 'Aerial Silk', 'Aerial Hoop', 'Kinderyoga', 'Polesport', 'twerXout®', 'Hula Hoop', 'Contemporary Dance', 'Step']",1 Angebot für Neukund:innen,"['https://files.eversports.com/86ae05b5-4c74-476a-b2d4-c269c2f98416/dd290718-b950-4071-8301-0e57ba0a4281jpeg-x-large.webp', 'https://files.eversports.com/615824a2-d4a6-462d-a128-834ba7d3bf90/02d1010d-290d-4632-a830-c86169518eb3jpeg-small.webp', 'https://files.eversports.com/f47def87-8934-48fa-a15a-0a02bd193e4f/8f45bb61-1a73-401a-a409-39935c95dbafjpeg-small.webp']",2023-12-23 17:13:46,2023-12-23 17:13:46
POLEside,"['Saline 5 ', ' 74177 Bad Friedrichshall']",74177,Bad,Saline 5 ,"['Übersicht', 'Klassen', 'Workshops', 'Videos', 'Preise', 'Team']","Willkommen bei POLEside!Lass Dich von uns mitreißen und tauche mit uns ein in die Welt von Pole Dance, Aerial Hammok (Tuch), Aerial Hoop (Luftring) und Aerial Yoga.Wenn du schon immer etwas Neues ausprobieren wolltest, am besten etwas mit Vielfalt, das Sport und Spaß miteinander verbindet? Dann bist Du bei uns genau richtig. Wir zeigen Dir eine andere Welt des Sports. Verschiedene Ganzkörper-Workouts in einer akrobatischen und kunstvollen Art, die Dein Selbstwertgefühl stärken und ein ganz neues Körpergefühl in Dir wecken. Wir möchten Dir zeigen, wie man Kraft, Eleganz, Körperspannung und Flexibilität miteinander vereint und den Spaß dennoch im Fokus behält. Probiere es aus und lass Dich von unserer Leidenschaft inspirieren. Schon nach ein paar Trainingseinheiten wirst Du Erste und vor allem motivierende Fortschritte feststellen können, welche Dich und uns zu weiterem Ehrgeiz animieren.","4,9",13 Rezensionen,"['Raumqualität: 4.8', 'Freundlichkeit & Service: 5.0', 'Sauberkeit: 5.0', 'Atmosphäre: 4.9', 'Preis-Leistung: 4.8']", info@poleside.de,http://poleside.de/,0176 870 191 81,https://www.eversports.de/s/poleside,"['Polesport', 'Poledance', 'Fitness', 'Aerial Yoga', 'Poledance', 'Poledance', 'Aerial Yoga', 'Aerial Yoga', 'Floorwork', '13 Rezensionen', 'Fitness', 'Poledance', 'Aerial Yoga', 'Floorwork', 'Aerial Dance', 'Aerial Hoop', 'Aerial Akrobatik', 'Polesport']",Zum Stundenplan,"['https://files.eversports.com/1d5b3c05-5ab4-4d7f-bb92-5dd22aea60a4/unbenannt-2png-x-large.webp', 'https://files.eversports.com/8e275248-c46e-4f8f-bae4-2d00bf99a0b5/unbenannt-4png-small.webp']",2023-12-23 17:14:46,2023-12-23 17:14:46
SPIN-UP,"['Könizstrasse 161', ' 3097 Liebefeld']",3097,Liebefeld,Könizstrasse 161,"['Übersicht', 'Klassen', 'Preise', 'Team']","Willkommen bei SPIN-UP Poledance in Bern. Ganz egal, ob du noch nie Pole Dance ausprobiert hast oder bereits regelmässig kopfüber hängst. Bei uns darfst du dich neu entdecken. Du wirst stärker, beweglicher und dein Selbstvertrauen wird explodieren. Gemeinsam feiern wir deine Erfolge.
Wir leben Pole Dance. Und wir lieben es, dich auf deiner Reise zu begleiten. 
Bei SPIN-UP bieten wir Euch professionelles Training in toller Atmosphäre. Wir trainieren in kleinen Gruppen, ohne Leistungsdruck aber mit dem grösstmöglichen Lernerfolg. Es liegt uns am Herzen, Euch individuell zu fördern - und nicht zu überfordern.
Sowohl Anfängern als auch fortgeschrittenen Schülern bieten wir fundierte Unterrichtsangebote. Nebst Poledance gehören dazu auch Krafttraining, Stretching, Chair- und Heels-Dance sowie Privatstunden. Ein besonderes Highlight sind unsere Polterabende und Geburtstagsparties. 
Wir haben uns zum Ziel gesetzt, euch ebenso von dem Tanz an der Stange zu begeistern wie wir es sind. Ihr sollt Spass haben und eine wundervolle Zeit mit uns verbringen! Komm vorbei und lass dich überzeugen!
Unsere Adresse:
STUDIO BERN
Vidmarhalle, 3. Stock.
Könizstrasse 161,
3097 Liebefeld-Bern
Tel. 078 807 56 87","4,9",21 Rezensionen,"['Raumqualität: 4.9', 'Freundlichkeit & Service: 5.0', 'Sauberkeit: 4.9', 'Atmosphäre: 5.0', 'Preis-Leistung: 4.9']", info@spin-up.ch,https://www.spin-up.ch/,+41788075687,https://www.eversports.de/s/spin-up,"['Poledance', 'Poledance', 'Poledance', 'Poledance', '21 Rezensionen', 'Poledance']",2 Angebote für Neukund:innen,"['https://files.eversports.com/f33f2c2a-60d1-463b-b01c-438727df6349/spin-up-team2jpgjpg-x-large.webp', 'https://files.eversports.com/5ea67cc1-0244-4983-b54a-abd84c763a21/spin-up-team1jpg-small.webp', 'https://files.eversports.com/3d481e49-2ade-484f-be5f-70afb5d0a70f/spin-up-team3jpg-small.webp', 'https://files.eversports.com/36ba56a3-9470-42a7-9a17-8db501454dec/beginnerjpg-small.webp', 'https://files.eversports.com/ee25d92b-a989-49f0-878d-e01d240e3ca3/82305557-dc72-407d-835d-0bb933f1c2f4jpeg-small.webp']",2023-12-23 17:15:59,2023-12-23 17:15:59
The Pole Jungle,"['Volksgartenstraße 19', ' 4020 Linz']",4020,Linz,Volksgartenstraße 19,"['Übersicht', 'Klassen', 'Trainings', 'Kurse', 'Preise', 'Team']","Wie der Name bereits sagt erwartet euch ein grüner Jungle mitten in der Linzer Innenstadt. Kombiniert mit Chrome Poles, wird das Design des Pole Studio noch einzigartiger. Wir schwingen uns nicht nur wie Tarzan und Jane von Pole zu Pole, sondern erleben das perfekte Jungle Feeling beim Trainieren. Wir verbinden den Sport, den wir lieben mit der positiven Wirkung der Zimmerpflanzen, um unseren (manchmal stressigen) Alltag auszugleichen.
The Pole Jungle ist mit gesamt 12 Pole Stangen ausgestattet in Chrome. Die lange Fensterfront und die wunderschöne Glaskuppel ermöglichen dem Tageslicht das Pole Studio zu fluten und ausreichend Helligkeit und Freundlichkeit in das Studio zu bringen.",5,9 Rezensionen,"['Raumqualität: 4.8', 'Freundlichkeit & Service: 5.0', 'Sauberkeit: 5.0', 'Atmosphäre: 5.0', 'Preis-Leistung: 5.0']", hello@thepolejungle.com,http://www.thepolejungle.com,+43 677 647 33 8 00,https://www.eversports.de/s/the-pole-jungle,"['Poledance', 'Poledance', 'Poledance', 'Poledance', 'Poledance', '9 Rezensionen', 'Poledance', 'Handstand', 'Chairdance', 'Polesport', 'Twerken']",Zum Stundenplan,"['https://files.eversports.com/c902a4a3-458a-456a-a593-4ca6e3bb948f/img_8035jpg-x-large.webp', 'https://files.eversports.com/182946f2-6001-4674-b3f6-763bb9484cf1/img_8006jpg-small.webp', 'https://files.eversports.com/b911b344-1986-460d-ac61-fb35502ea8f3/img_8049jpg-small.webp', 'https://files.eversports.com/f0fc9c85-10d7-4b5d-a7c5-f384d1c7d095/img_8018jpg-small.webp', 'https://files.eversports.com/edbc8c1e-10be-41ef-8b22-9895c32c9ee7/img_8057jpg-small.webp']",2023-12-23 17:16:08,2023-12-23 17:16:08
Glow Sports Club,"['Industriepark 201 ', ' 78244 Gottmadingen']",78244,Gottmadingen,Industriepark 201 ,"['Übersicht', 'Klassen', 'Trainings', 'Workshops', 'Preise', 'Team']","In unserem Glow Sports Club sind alle herzlich Willkommen ganz nach unserem Motto - FOR EVERYBODY & EVERY BODY!In unserem hellen und modernen Studio stehen dir drei Kursräume mit 144m² Fläche zur Verfügung. Du wirst von einem top ausgebildeten und motivierten Team empfangen.Unsere Deckenhöhe beträgt 3.60m, perfekte Bedingungen für Aerial Sports. Durch unsere großzügig verspiegelten Wände könnt ihr euch während dem Training selbst gut beobachten. Der Unterricht findet in kleinen Gruppen statt, so können wir dir immer eine familiäre Atmosphäre bieten.It’s not only a Club – It’s a feeling",5,13 Rezensionen,"['Raumqualität: 4.9', 'Freundlichkeit & Service: 5.0', 'Sauberkeit: 5.0', 'Atmosphäre: 5.0', 'Preis-Leistung: 4.9']", info@glowsportsclub.de,http://www.glowsportsclub.de,+49 171 6444114,https://www.eversports.de/s/glow-sports-club,"['Aerial Yoga', 'Faszientraining', 'Poledance', 'Polesport', 'Tanzen', 'Pilates', 'Pilates', 'Poledance', 'Poledance', 'Tanzen', '13 Rezensionen', 'Fitness', 'Pilates', 'Tanzen', 'Yoga', 'Poledance', 'Aerial Yoga', 'Rückenfit', 'Funktionelles Training', 'Barre-Training', 'Faszientraining', 'Stretching', 'Lapdance', 'Chairdance', 'Aerial Silk', 'Aerial Hoop', 'Aerial Akrobatik', 'Hatha Yoga', 'Polesport', 'Bauch, Beine, Po', 'Jumping Fitness', 'Mobility', 'Bodyfit', 'Seminar', 'Vorträge', 'Tanz-Fitness', 'Twerken', 'Dehnbarkeit und Beweglichkeit', 'Exotic', 'Gesundheitstraining', 'Vinyasa Flow', 'Gesundheitssport', 'Workshop']",1 Angebot für Neukund:innen,"['https://files.eversports.com/7a1b1df5-c55b-416d-bdc2-2229b2e3b9bf/0s6a3462jpg-x-large.webp', 'https://files.eversports.com/52f7e4f0-b029-4aa2-a1cb-80c3a62eaa35/0s6a2991jpg-small.webp', 'https://files.eversports.com/cf306b05-64be-4333-8ec0-25ce471728ed/0s6a1326-2jpg-small.webp', 'https://files.eversports.com/a01d3cb0-b87d-4543-9fcc-91f6538b835f/0s6a3313-2jpg-small.webp', 'https://files.eversports.com/f5c6ee5b-e096-48a0-b015-16359497d33b/0s6a3456jpg-small.webp']",2023-12-23 17:16:18,2023-12-23 17:16:18
ST Polestudio,"['Walkmühleweg 47', ' 75365 Calw']",75365,Calw,Walkmühleweg 47,"['Übersicht', 'Klassen', 'Preise', 'Team']","Diese Sportanlage bietet eine Vielzahl an Sportarten an. Sieh dir das breite Angebot der Anlage an, wie z.B. Sportplätze, Klassen, Trainings, Workshops, Camps, etc. Finde weitere Informationen wie Bewertungen, Standort, Preise, Lehrer:innen und Trainer:innen, sowie FAQs weiter unten.","4,7",11 Rezensionen,"['Raumqualität: 4.8', 'Freundlichkeit & Service: 4.8', 'Sauberkeit: 4.5', 'Atmosphäre: 4.8', 'Preis-Leistung: 4.5']", st_polestudio@yahoo.de,https://www.st-polestudio.de/,+49 1733746944,https://www.eversports.de/s/st-polestudio,"['Poledance', 'Poledance', 'Poledance', 'Poledance', '11 Rezensionen', 'Poledance']",Zum Stundenplan,[],2023-12-23 17:17:34,2023-12-23 17:17:34
Polesition Regensburg,"['Rebhuhnstraße 4', ' 93326 Abensberg']",93326,Abensberg,Rebhuhnstraße 4,"['Übersicht', 'Preise']","Polesition Regensburg bietet Kurse in Poledance und Dance sowie Aerial Classes. In dem 300 qm liebevoll eingerichteten Studio wird Frauen aller Altersgruppen und jeglicher Figur das Tanzen beigebracht, denn Tanzen ist vor allem eine Frage der Sinnlichkeit. Hier findest du die richtige Mischung aus Tanz, Akrobatik und Fitness. Neben Poledance, Dance und Aerial Classes werden auch Flying Yoga, Deepwork, Bodyart, Stretch & Flex und Faszibility angeboten.","4,9",27 Rezensionen,"['Raumqualität: 4.9', 'Freundlichkeit & Service: 4.9', 'Sauberkeit: 4.9', 'Atmosphäre: 5.0', 'Preis-Leistung: 4.6']", office@polesition-regensburg.de,http://www.polesition-regensburg.de,,https://www.eversports.de/s/polesition-regensburg,"['27 Rezensionen', 'Pilates', 'Tanzen', 'Poledance', 'Aerial Yoga', 'Personal Training', 'Gruppenangebote', 'Tagestarife', 'Faszientraining', 'Stretching', 'Floorwork', 'Lapdance', 'Chairdance', 'Aerial Dance', 'Aerial Hoop']",2 Angebote für Neukund:innen,['https://files.eversports.com/a73d40e1-eaf2-4300-b464-141124923110/13631394_1634636236854453_5896347896473718519_n-x-large.webp'],2023-12-23 17:17:59,2023-12-23 17:17:59
Pole and Move Ludwigshafen,"['Raschigstraße 100', ' 67067 Ludwigshafen am Rhein']",67067,Ludwigshafen,Raschigstraße 100,"['Übersicht', 'Klassen', 'Workshops', 'Preise', 'Team']",Neueröffnung am 19.Juni 2023,5,8 Rezensionen,"['Raumqualität: 5.0', 'Freundlichkeit & Service: 5.0', 'Sauberkeit: 5.0', 'Atmosphäre: 5.0', 'Preis-Leistung: 5.0']", team@poleandmove.de,https://poleandmove.de/,+49176 61653663,https://www.eversports.de/s/pole-and-move-ludwigshafen,"['Fitness', 'Poledance', 'Poledance', 'Aerial Yoga', 'Aerial Yoga', 'Poledance', 'Poledance', 'Power Pole', 'Raumvermietung', 'Poledance', '8 Rezensionen', 'Poledance', 'Aerial Yoga', 'Flexibles Training', 'Power Pole', 'Lapdance', 'Chairdance', 'Aerial Hoop', 'Aerial Akrobatik', 'Polesport', 'Burlesque', 'Contemporary Dance', 'Exotic', 'Stärkung/Flexibilität', 'Pole handstand', 'Privates Training', 'Aerial Hammock']",3 Angebote für Neukund:innen,"['https://files.eversports.com/8d4fd1ac-e5e7-4335-a2c1-c7ed3c813df8/miriams-4429jpg-x-large.webp', 'https://files.eversports.com/c359e37a-42ff-4943-bcf6-95adbd64e951/miriams-3096jpg-small.webp']",2023-12-23 17:18:10,2023-12-23 17:18:10
Soultide,"['Süderstraße 159A ', ' 20537 Hamburg']",20537,Hamburg,Süderstraße 159A ,"['Übersicht', 'Klassen', 'Workshops', 'Retreats', 'Preise', 'Team']","Als Soultide ist es uns das größte Anliegen, dir mit unserem Studio einen “Safe Space” zu erschaffen, der es dir ermöglicht, all das zu sein, was du sein willst. Mit viel Spaß und Empowerment kannst du bei uns ungeahnte Fähigkeiten entdecken und dir in jeder Bewegung oder jedem Innehalten selbst begegnen. Ob Pole Dance in verschiedenen Stilen, Aerial Hoop, Aerial Silk, Aerial Hammock, Tease Kurse wie Floor, Chair Dance, Lap Dance, Twerk, oder doch Yoga. Genau wie das Auf und Ab der Gezeiten beeinflusst vom Mond, entscheidest du nach eigenem Befinden, welche Bewegungsrichtung gerade die richtige für dich ist. Wir sind gespannt, welche Entwicklung dein Weg bei uns für dich bereithält.","4,9",68 Rezensionen,"['Raumqualität: 4.9', 'Freundlichkeit & Service: 5.0', 'Sauberkeit: 5.0', 'Atmosphäre: 5.0', 'Preis-Leistung: 4.8']", hello@soultide-studio.de,https://soultide-studio.de/,,https://www.eversports.de/s/soultide,"['Floorwork', 'Lapdance', 'Poledance', 'Aerial Dance', 'Aerial Silk', 'Poledance', '68 Rezensionen', 'Yoga', 'Poledance', 'Aerial Yoga', 'Floorwork', 'Lapdance', 'Chairdance', 'Aerial Silk', 'Aerial Dance', 'Aerial Hoop', 'Aerial Akrobatik', 'Heels', 'Twerken', 'Contemporary Dance']",2 Angebote für Neukund:innen,"['https://files.eversports.com/fc2ddda9-5ed5-49ed-a41e-2228042722d9/_z3a3511jpg-x-large.webp', 'https://files.eversports.com/2ee06614-fc53-4fa7-8874-f20ff15f8c05/_z3a5459jpg-small.webp', 'https://files.eversports.com/fb635035-e576-48cd-a3fc-745e325248c4/_z3a3811-2jpg-small.webp', 'https://files.eversports.com/5ebcecd6-057b-49e0-83e0-0549dfb5a309/_z3a3557jpg-small.webp', 'https://files.eversports.com/8918da0d-3b95-4898-aae9-d8f1d6b9c8da/_z3a6777jpg-small.webp']",2023-12-23 17:18:57,2023-12-23 17:18:57
Pole and Move Mannheim,"['Edisonstraße 20 ', ' 68309 Mannheim']",68309,Mannheim,Edisonstraße 20 ,"['Übersicht', 'Klassen', 'Workshops', 'Preise', 'Team']","Willkommen bei Pole and Move. Unsere Studios befinden sich in Mannheim, Heidelberg und Ketsch und natürlich auch Online. Wir sind ein junges, dynamisches und motiviertes Unternehmen in der Sport- und Fitnessbranche, welches sich hauptsächlich auf den Polesport & Arial Arts konzentriert.Wir freuen uns auf alle Tanz- und Sportbegeisterte, die uns einmal besuchen möchten.","4,9",46 Rezensionen,"['Raumqualität: 4.8', 'Freundlichkeit & Service: 4.9', 'Sauberkeit: 5.0', 'Atmosphäre: 5.0', 'Preis-Leistung: 4.8']", team@poleandmove.de,https://poleandmove.de/,+49176 61653663,https://www.eversports.de/s/pole-and-move-mannheim,"['Fitness', 'Tanzen', 'Poledance', 'Power Pole', 'Power Pole', 'Poledance', 'Raumvermietung', 'Power Pole', 'Poledance', 'Aerial Yoga', '46 Rezensionen', 'Fitness', 'Poledance', 'Raumvermietung', 'Power Pole', 'Stretching', 'Handstand', 'Lapdance', 'Chairdance', 'Aerial Hoop', 'Polesport', 'Burlesque', 'Twerken', 'Pole Contempo', 'Pole handstand', 'Sling']",3 Angebote für Neukund:innen,"['https://files.eversports.com/0db99d38-69d4-40a9-8f26-a66645108783/miriams-web-4349jpg-x-large.webp', 'https://files.eversports.com/20322885-9870-45b2-a937-8b1dd559fc9f/img_8657jpg-small.webp', 'https://files.eversports.com/d91c429a-44a2-492f-bd7e-433c43f8f98b/larab-web-2389jpg-small.webp', 'https://files.eversports.com/3db2b6df-d52a-4bc8-b9c6-b304661f811f/img_8667jpg-small.webp']",2023-12-23 17:20:53,2023-12-23 17:20:53
