122,LOFT1 BASEL CITY,4051,Centralbahnplatz 10 , 4051 Basel,"Hell und freundlich und mit 13 Stangen ausgestattet, präsentiert sich das neue Loft1- Studio im gewohnten Stil, direkt am Bahnhof von Basel.
Ein kleiner Balkon, die hohe Decke und der Blick auf den Bahnhofsplatz machen dieses Studio zu etwas besonderem.
Im Loft1 Basel City werden folgende Kurse angeboten: Polefitness, Aerial Hoop und Stretching
Weitere Angebote sind: Schnupperlektionen, Privatstunden, Workshops und Polterevents.
Loft1 steht für Qualität. Unser Ziel ist es dass sich unsere Kunden in den Loft1 Studios wohl fühlen und gemeinsam mit uns ihre Ziele erreichen. Dabei ist der Spass - Faktor im Vordergrund.
Unser Motto: Fitness muss Freude machen.
In den Loft1 Studios herscht eine schöne und unkomplizierte Atmosphäre. Alle Frauen egal in welchem Alter sind bei uns herzlich willkommen!",0,4.7,27 Rezensionen, info@loft1.ch,https://www.loft1.ch/studio-basel-2-2/,0,https://www.eversports.de/s/LOFT1-BASEL-CITY,2023-05-12 20:50:53
123,Body meets Soul Leipzig,4159,Hüfnerstraße , 04159 Leipzig,"„Sorge dich gut um deinen Körper. Es ist der einzige Ort, den du zum Leben hast.“
– Jim Rohn –
Bei BodymeetsSoul steht nicht nur dein Körper im Mittelpunkt. Körper und Geist sind untrennbar miteinander verbunden. Egal ob Yoga oder/und Poledance – ich biete dir Bewegung bei gleichzeitiger Entschleunigung. Ich helfe dir, an deine Grenzen zu gehen, sie zu respektieren und mit ihnen zu spielen. Fordere dich, aber überfordere dich nicht. Du bist verantwortlich für deinen Erfolg – ich für den Prozess.",0,5.0,6 Rezensionen, info@bodymeetssoul-leipzig.de,http://www.bodymeetssoul-leipzig.de,+49  1573 1360379,https://www.eversports.de/s/Body-meets-Soul-Leipzig,2023-05-12 20:50:53
124,Munich Poledance,80636,Leonrodplatz 2, 80636 München,"Herzlich Willkommen bei Munich Poledance.
In einer entspannten und freundlichen Atmosphäre kannst Du Deine ersten Schritte im Poledance wagen, über Dich selbst hinauswachsen und vor allem ganz viel Freude an Bewegung haben.
Wie der Name schon sagt, liegt der Fokus bei Munich Poledance ganz klar auf Poledance (Static, Spin, Heels,...), aber das Angebot umfasst auch weitere Formate wie Aerial Hoop, Chairdance, Floorwork, Lapdance und Strip'nTease sowie FeetUp, Flexibility, Workout und Yoga. Sämtliche Formate können je nach Kursplan als Gruppenkurse oder auf Anfrage auch als Privatstunden/private Kleingruppen gebucht werden. Außerdem gibt es die Möglichkeit für Freies Training im Beisein einer Trainerin. Auch für Mädelsabende, (Geburtstags-)Partys, sowie Junggesellinnenabschiede wird Munich Poledance gerne gebucht.
Bei uns sind natürlich alle Altersstufen und Erfahrungs-Niveaus herzlich Willkommen.
Durch große Fensterfronten wirkt das Studio sehr hell und freundlich. Eine Umkleide mit geräumigen Spinden sowie 2 Duschen ist für unsere KundInnen natürlich auch vorhanden.
Das Munich Poledance Studio liegt direkt am Leonrodplatz in München und ist gut mit den öffentlichen Verkehrsmitteln (Straßenbahnlinie 12/20/21 sowie Buslinie 53) sowie dem Fahrrad und Auto erreichbar.
Über das Team
Seit April 2020 ist die langjährige Trainerin Isabel nun Inhaberin von Munich Poledance.
Da sie Studentin im Bereich Fitness- & Gesundheitsmanagement ist, liegt ihr die Nachhaltigkeit des Trainings sowie ständige Aus- und Weiterbildung sehr am Herzen. Um ein möglichst gesundes, sicheres und vielfältiges Training anzubieten, ist das Munich Poledance Trainerteam deswegen sehr gut ausgebildet und hochwertig zertifiziert.
Natürlich soll der Spaß und Freude an Bewegung auch nicht zu kurz kommen und so bringen alle TrainerInnen ihre eigene Seite und den persönlichen Humor mit in die Stunden mit ein.
Besuche uns und lerne unser einzigartiges Trainerteam kennen!
Fragen und Antworten
Was sollte ich sonst noch wissen?
Alle häufig gestellten Fragen findest Du in unserem Q&A auf der Website. Für weitere Fragen steht Dir das MPD Team per E-Mail (isabel@munich-poledance.de) oder telefonisch/per WhatsApp unter 015906736735 gerne zur Verfügung.",0,4.9,74 Rezensionen, isabel@munich-poledance.de,https://www.munich-poledance.de,015906736735,https://www.eversports.de/s/Munich-Poledance,2023-05-12 20:50:54
125,UpsideDown Studio Friedrichsdorf,61381,Am Houiller Platz 4D , 61381 Friedrichsdorf,"Das Studio UpsideDown ist in Friedrichsdorf zu finden. Interessierte können Aerial Hoop (Luftkünste), Poledance, Stretch und Relax trainieren. Für Freiluftenthusiasten ist ein Outdoor-Training, eine Kombination aus Kraft und Ausdauer, möglich. Aerial Hoop wird in luftiger Höhe praktiziert und kommt einem Flug durch die Lüfte sehr nahe. Im Studio UpsideDown können Neueinsteiger ihre Fitness auf akrobatische Weise auf die Probe stellen.",0,4.8,3 Rezensionen, info@upsidedown-studio.de,https://www.upsidedown-studio.de/,+491724519252,https://www.eversports.de/s/UpsideDown-Studio-Friedrichsdorf,2023-05-12 20:50:55
126,Pole Paradise,50739,Ravensburgerstraße 110-112, 50739 Köln,"Das Pole Paradise in Köln ist ein Studio, in dem Tanz und Leidenschaft mit der Stange eins werden. Angeboten werden Poledance Kurse auf verschiedenen Leveln, verschiedene Gymnastikkurse an der Stange, Aerial Hoop und Aerial Flow. Es gibt auch spezielle Angebote für Kids, Workshops, Ferienrabatte und Einsteiger-Angebote. Das Angebot ist umfangreich, komm einfach mal vorbei und lass dich von Poledance im Pole Paradise überzeugen",0,4.9,61 Rezensionen, poleparadise@gmx.de,https://www.pole-paradise.com,+491774616007,https://www.eversports.de/s/Pole-Paradise,2023-05-12 20:50:56
127,Luftbonbon,32547,Königstraße 45 , 32547 Bad Oeynhausen,"Diese Sportanlage bietet eine Vielzahl an Sportarten an. Sieh dir das breite Angebot der Anlage an, wie z.B. Sportplätze, Klassen, Trainings, Workshops, Camps, etc. Finde weitere Informationen wie Bewertungen, Standort, Preise, Lehrer:innen und Trainer:innen, sowie FAQs weiter unten.",0,5.0,9 Rezensionen, info@luftbonbon.com,https://www.luftbonbon.com/,01622572081,https://www.eversports.de/s/Luftbonbon,2023-05-12 20:50:57
128,Center of Moving Arts,64625,Fabrikstraße 21, 64625 Bensheim,"Das Center of Moving Arts liegt 100m entfernt vom Edeka Jakobi Center in Bensheim.
Das Studio hat 3 Tanzräume und eine gemütliche Bar mit über 700qm. Liebevoll eingerichtet mit einer Lounge erwartet dich ein Tanzzentrum mit Stil und Charme im ""Industrial - Look"". Du kannst frei nach belieben Kurse wie Pole-Dance, Aerial Hoop, Hip Hop / New Style / Millennium Classes / Videoclip, Jazz / Modern / Contemporary, Bungee Dance und Yoga buchen. Die ausnahmslos professionell ausgebildete Dance-Coaches sorgen in jedem Style für Energie, Niveau und Spaß.
Du erreichst das Center of Moving Arts zu Fuß in 10min vom Hauptbahnhof und hast direkt vor unserem Center Parkmöglichkeiten.",0,4.9,18 Rezensionen, info@center-of-moving-arts.de,http://www.center-of-moving-arts.de,+4962519447196,https://www.eversports.de/s/Center-of-Moving-Arts,2023-05-12 20:50:58
129,Glow Sports Club,78244,Industriepark 201 , 78244 Gottmadingen,"In unserem Glow Sports Club sind alle herzlich Willkommen ganz nach unserem Motto - FOR EVERYBODY & EVERY BODY!
In unserem hellen und modernen Studio stehen dir drei Kursräume mit 144m² Fläche zur Verfügung. Du wirst von einem top ausgebildeten und motivierten Team empfangen.
Unsere Deckenhöhe beträgt 3.60m, perfekte Bedingungen für Aerial Sports. Durch unsere großzügig verspiegelten Wände könnt ihr euch während dem Training selbst gut beobachten. Der Unterricht findet in kleinen Gruppen statt, so können wir dir immer eine familiäre Atmosphäre bieten.
It’s not only a Club – It’s a feeling",0,4.9,13 Rezensionen, info@glowsportsclub.de,http://www.glowsportsclub.de,+49 171 6444114,https://www.eversports.de/s/Glow-Sports-Club,2023-05-12 20:50:58
130,pure body concepts OLD,85591,Zugspitzstraße 2A, 85591 Vaterstetten,"Diese Sportanlage bietet eine Vielzahl an Sportarten an. Sieh dir das breite Angebot der Anlage an, wie z.B. Sportplätze, Klassen, Trainings, Workshops, Camps, etc. Finde weitere Informationen wie Bewertungen, Standort, Preise, Lehrer:innen und Trainer:innen, sowie FAQs weiter unten.",0,0.0,(Noch keine Bewertungen), info@pure-body-concepts.de,0,+49 8106 3774499,https://www.eversports.de/s/pure-body-concepts,2023-05-12 20:50:59
131,Aerial Circus,4229,Zschochersche Straße 79B , 04229 Leipzig,"Hallo,
und schön, dass Du auf unserer Seite gelandet bist! Seit 2015 gibt es den Aerial Circus nun schon, einen Ort, an dem Begegnung stattfindet, getanzt wird und du an verschiedensten Luftrequisiten über dich hinaus wachsen kannst. Wir haben viele spannende Kurse, regelmäßige Auftritte, tolle Trainer_Innen und natürlich Teilnehmende. In unserem 55m² Studio kannst du dich an sechs Poles, vier Vertikaltüchern (Aerial Silks) und vier Luftringen (Aerial Hoops) austoben.Für schwierigere Elemente stehen Crash-Matten bereit. Zum Kraftaufbau stellen wir ein Kletterseil, Gymnastikbälle und eine Sprossenwand zur Verfügung. Wer sich in Flexibilität steigern möchte findet ebenfalls Matten, Yogawheels, -blöcke und -gurte, sowie Faszienrollen und -bälle.
Wir freuen uns sehr über neue und alte Gesichter in unserem wunderschönen Studio!
Ganz herzliche Grüße,
Lena und das gesamte Aerial Circus Team (mit Sina, Paula, Max, Josi, Anne, Anna und Mareen).",0,5.0,2 Rezensionen, aerial-circus@mail.de,http://www.aerial-circus.de,+49 15774280801,https://www.eversports.de/s/Aerial-Circus,2023-05-12 20:50:59
132,Pole Oase,65385,Kleine Grabenstraße 1, 65385 Rüdesheim am Rhein,"Pole Oase ist das erste Pole Dance Studio im Rheingau und besteht seit März 2018. Mit viel Leidenschaft und Herzblut unterrichten unsere professionell ausgebildeten Trainer verschiedene Disziplinen wie Pole Dance, Exotic Pole, Aerial Hoop, Twerk u.a.
Unser Pole Dance Raum besteht aus 6 doppelt verstärkten Stangen aus Chrome mit großzügig Platz zwischen jeder Stange, einer großen Spiegelwand und großen Fenstern für viel Tageslicht. Verschiedenfarbige Lampen runden die Stimmung ab.
Unser Aerial Raum umfasst 4 Reifen (Aerial Hoop), die in verschiedenen Höhen aufgehängt werden können.
Außerdem gibt es einen abgegrenzten Thekenbereich mit Sitzmöglichkeiten, einen richtigen Umkleideraum und Sanitäranlagen. Im Hof stehen euch zudem kostenfreie Parkplätze zur Verfügung.",0,5.0,15 Rezensionen, info@pole-oase.de,https://pole-oase.de/,+49 15785939882,https://www.eversports.de/s/Pole-Oase,2023-05-12 20:50:59
133,Poledance-Area,42853,Mandtstraße 2 , 42853 Remscheid,"Diese Sportanlage bietet eine Vielzahl an Sportarten an. Sieh dir das breite Angebot der Anlage an, wie z.B. Sportplätze, Klassen, Trainings, Workshops, Camps, etc. Finde weitere Informationen wie Bewertungen, Standort, Preise, Lehrer:innen und Trainer:innen, sowie FAQs weiter unten.",0,4.4,1 Rezensionen, info@poledance-area.de,http://www.poledance-area.de,+49 01623675667,https://www.eversports.de/s/Poledance-Area,2023-05-12 20:51:00
134,Da Becca Flow and Fit,44651,Eickeler Markt 3A , 44651 Herne,"Für Neukunden-bitte eine Email bei Interesse an unseren Kursen an info@dabecca.de .
Da Becca Flow and Fit - wir heissen Dich herzlich willkommen in unserem wunderschönen Pole/Floorwork/ Tanzstudio. Hier wird wert auf persönliche und kleine Lerngruppen gelegt und Dir ein Safespace für Frauen mit professioneller Betreuung geboten. Trainingserfolge mit Spass , viel Musik, Tanzen und auch schweisstreibenden Stretching und Choreos. Mal sensual, mal rockig , mal contemporary . Wir haben Dir im kleinen rahmen viel zu bieten . Wir freuen uns auf das Tanzerlebnis mit Dir oder auch in unseren Mobility Kursen mit Dir an Deiner flexibilität und Kraft zu arbeiten !!!
Wir arbeiten mit Flatrates und 10 und 5 er Karten daher seid euch bitte im klaren das nicht immer gewährleistet ist das ihr euren Wunschkurs jede Woche belegen könnt dafür aber bis zu 80 Kurse im Monat zur Auswahl habt !!",0,5.0,21 Rezensionen, info@dabecca-flowandfit.de,http://www.dabecca-flowandfit.de,+49 17620913644,https://www.eversports.de/s/Da-Becca-Flow-and-Fit,2023-05-12 20:51:01
135,Tanzstudio Michel,55252,Schmalweg 50, 55252 Wiesbaden,"Das etablierte Tanzstudio in Wiesbaden bietet professionelles Tanztrainig und Kurse zum fit werden. Ein heller, geräumiger, eigens für den Tanzunterricht gestalteter Trainingssaal ist bereit dir alle Möglichkeiten zu bieten noch besser zu werden. Tanz und Schönheit der Bewegung – hier sind diese zwei Begriffe untrennbar.",0,5.0,1 Rezensionen, t.michel.9@gmx.de,https://www.tanzstudio-michel.de/,+49 15115125871,https://www.eversports.de/s/Tanzstudio-Michel,2023-05-12 20:51:02
136,Pole Plus,86156,Ulmer Straße 152 , 86156 Augsburg,"Pole-Dance ist so viel mehr als ein Tanz an der Stange.
Ursprünglich kommt Pole-Dance aus dem chinesischen Zirkus und wurde nur von Männern ausgeübt, der akrobatische Aspekt ist demnach definitiv nicht zu vernachlässigen.
Wir möchten dir im Pole Plus zeigen, was die absolute Trendsportart alles zu bieten hat.
Denn genau wegen seiner Vielseitigkeit erfreut sich der Pole-Sport so einer großen Beliebtheit und fasziniert einfach jeden.
Das Training setzt sich zusammen aus einem Aufwärm-Programm, dem Pole-Training und einem Cool-Down.
Wir trainieren verschiedene Figuren, Posen, Kombinationen, akrobatische Elemente und auch Choreografien.
Du benötigst für unsere Anfängerkurse keinerlei Vorkenntnisse und auch kein spezielles Fitness-Level.
Wir freuen uns auf dich!",0,4.9,5 Rezensionen, info@pole-plus.com,http://www.pole-plus.com,+49 15776626728,https://www.eversports.de/s/Pole-Plus,2023-05-12 20:51:02
137,Aerial Studio,3565,Mississippidreef 2, 3565 CG Utrecht,"Diese Sportanlage bietet eine Vielzahl an Sportarten an. Sieh dir das breite Angebot der Anlage an, wie z.B. Sportplätze, Klassen, Trainings, Workshops, Camps, etc. Finde weitere Informationen wie Bewertungen, Standort, Preise, Lehrer:innen und Trainer:innen, sowie FAQs weiter unten.",0,4.8,16 Rezensionen, info@aerial-studio.nl,https://www.aerial-studio.nl,+31 628209884,https://www.eversports.de/s/Aerial-Studio,2023-05-12 20:51:03
138,Polefly Academy,86167,Bürgermeister-Wegele-Straße 6A , 86167 Augsburg,"Polefly Academy - dein ""place to be"" in Augsburg, wo du die Schwerkraft tanzend überwinden wirst.
Wir bieten Pole Dance Stunden an und fokussieren uns dabei auf den tänzerischen Stil. Bei uns trainierst du in den Leveln Anfänger, Mittelstufe und Fortgeschrittenen in einer festen Gruppe und wir lernen gemeinsam Choreographien, die mit der Zeit immer anspruchsvoller werden. Ebenso bieten wir Spezialkurse (z.B. Floorwork und Exotic), Workshops und Junggesellinnenabschiede an. Auch abseits der Pole wirst du bei uns sicherlich fündig. Unser Kursangebot aus den Bereichen Yoga, Stretching und Fitness wird stetig erweitert. Komm gerne vorbei, wir freuen uns :-)",0,5.0,2 Rezensionen, office@polefly-academy.de,0,0,https://www.eversports.de/s/Polefly-Academy,2023-05-12 20:51:04
139,Pura Studio,52477,Schaufenberger Straße 61 , 52477 Alsdorf,"Pura ist ein Yoga , Stretching , Poledance und Aerial Hoop Studio in Alsdorf.
Wir bieten unsere Kurse unter professioneller Anleitung an.
Ob Probestunden,Einzeltickets,10er Karten, Abos, Privatstunden, Workshops, Pole Parties, Junggesellinnen Abschiede oder Fotoshootings, wir haben für jeden das richtige Angebot.
Wir bieten ein modernes und attraktives Studio mit zwei Kursräumen und auch für das passende Equipment der jeweiligen Kurse ist gesorgt.
Du brauchst also nichts weiter als vorbei zu kommen und dich von unserer Leidenschaft anstecken zu lassen.
Wir sind überzeugt, dass du durch das Training in unserem Studio ein erhöhtes Selbstbewusstsein, eine verbesserte körperliche Fitness und eine größere mentale Stärke erreichen wirst.",0,5.0,60 Rezensionen, info@pura-studio.de,http://www.pura-studio.de,+49 1772836563,https://www.eversports.de/s/Pura-Studio,2023-05-12 20:51:04
140,Tanzschule Poledance Reutlingen,72793,Uhlandstraße 60 , 72793 Pfullingen,"Die Tanzschule Poledance Reutlingen befindet sich in der Uhlandstraße 60 in 72793 Reutlingen- Pfullingen. Wir bieten Kurse in Poledance, Aerial Silk und Aerial Hoop an. Außerdem gibt es Conditioning Kurse wie Stretching, freies Training und Handstand. Komm bitte 10 min. vor Unterrichtsbeginn damit du dich in Ruhe umziehen und noch eventuelle Fragen klären kannst. Ziehe Sportkleidung an und bringe ein Handtuch für deine Matte mit, für die Poledance Kurse brauchst du eine kurze Hose. Du kannst direkt vor dem Haus, an der Straße kostenlos parken, ca. 10 Minuten zu Fuß befindet sich außerdem eine Bushaltestelle.
Komm vorbei- wir freuen uns auf dich!",0,4.9,39 Rezensionen, info@poledance-reutlingen.de,https://www.poledance-reutlingen.de,0,https://www.eversports.de/s/Tanzschule-Poledance-Reutlingen,2023-05-12 20:51:10
141,Polearize,44793,Rottstraße 6 , 44793 Bochum,"Das Poledance-Studio Polearize liegt mitten im Herzen von Bochum und ist fußläufig vom Hauptbahnhof erreichbar. Die Anfängerkurse beginnen immer mit den absoluten Grundlagen. Du musst vorher weder sportlich sein noch tänzerische Vorerfahrung haben. Wenn Du schon länger Pole Dance tanzt, findest Du in den höheren Leveln die passende Herausforderung. Polearize liebt Sport und die Trainer geben alles, damit Du Dich wohl fühlst und Dich jedes Mal auf das Training freuen kannst. Mit Fachwissen und jahrelanger Erfahrung unterstützen wir Dich dabei, Deine Ziele effektiv und auf gesunde Weise zu erreichen. Außer Pole Dance wird auch Aerial Hoop, Stretching, Chairdance und Twerk angeboten.",0,4.9,74 Rezensionen, info@polearize.de,https://www.polearize.de/,+49 01636331603,https://www.eversports.de/s/Polearize,2023-05-12 20:51:10
142,Aerial Loft,70806,Bahnhofstraße 12 , 70806 Kornwestheim,"Du interessierst dich für Aerial Fitness wie Pole Dance oder Akrobatik mit dem Hoop? Dann nutze jetzt die Gelegenheit und komm vorbei.
Bitte beachte für die Teilnahme an den Kursen unsere geltenden Hygieneregeln: https://aerial-loft.de/studio/#hygiene-hinweise
Wachse im Aerial Loft über dich hinaus und erlebe das Gefühl von Tanz und Akrobatik vereint. Vergiss dabei die Alltagssorgen und schüttel den Stress einfach ab. Im Aerial Loft wirst du von einem professionellen Team betreut und kannst in einem Modernen und komplett ausgestatteten Studio trainieren, das dir neben den vielen Aerial-Kursen auch viele Yoga-Kurse bietet. Ob Fortgeschritten, Anfänger oder kompletter Neuling, es gibt den perfekten Kurs für jedermann. Wirf einen Blick in unseren Stundenplan oder sprich das Team direkt an.",0,4.9,51 Rezensionen, info@aerial-loft.de,http://www.aerial-loft.de,+49 1733429658,https://www.eversports.de/s/Aerial-Loft,2023-05-12 20:51:11
143,The Supergirl Studio,85221,Brunngartenstraße 5a , 85221 Dachau,"Trainiere wie ein Supergirl im “The Supergirl Studio”.
Wir bieten Pole Fitness, Exotic/Heels Pole sowie Aerial Hoop, Aerial Silks und Stretching Kurse für Erwachsene an.
In unseren Kursen kannst Du Deinen gesamten Körper, also Bauch, Beine, Po und Arme an der Stange in Form bringen. Hierzu brauchst Du in unseren Basic Kursen keine Vorkenntnisse, einfach anmelden und ausprobieren.
Alle Altersstufen sind hier willkommen und können je nach Niveau am Anfängerkurs (Basic) oder bei den Fortgeschrittenen (Intermediate und/oder Advanced) sowie mixed level Kursen mitmachen.
Kinder können sich im “Pole Fitness Kids” austoben und in ausgewählten Aerial Stunden durch die Lüfte fliegen.
Das Studio ist dank der großen Fenster sehr hell und wirkt sehr einladend.
Duch die hohen Decken sind uns nach oben (fast) keine Grenzen gesetzt und Du kannst bei uns hoch hinaus...",0,4.9,96 Rezensionen, supergirl@poledance-dachau.de,http://www.poledance-dachau.de,+4915758721177,https://www.eversports.de/s/The-Supergirl-Studio,2023-05-12 20:51:12
144,Poleart_Inspiration,87700,Allgäuer Straße 12 , 87700 Memmingen,"Diese Sportanlage bietet eine Vielzahl an Sportarten an. Sieh dir das breite Angebot der Anlage an, wie z.B. Sportplätze, Klassen, Trainings, Workshops, Camps, etc. Finde weitere Informationen wie Bewertungen, Standort, Preise, Lehrer:innen und Trainer:innen, sowie FAQs weiter unten.",0,0.0,(Noch keine Bewertungen), sarahsonja.pole@gmail.com,https://www.poleartinspiration.de/,0,https://www.eversports.de/s/Poleart_Inspiration,2023-05-12 20:51:12
145,PoleCreation,87435,Immenstädter Straße 11 , 87435 Kempten (Allgäu),"Du bist neu hier? Melde dich bitte ausschließlich vorab per Mail!
polecreatinstudio@gmail.com
Herzlich Willkommen bei PoleCreation! Lerne dich selbst zu kreieren!
Dein Studio in Kempten für Poledance, Fitness, Flexi und Akrobatik!​
Dich erwartet in stets freundlicher und motivierender Atmosphäre ein Training ohne Druck.
Egal ob Anfänger oder Fortgeschrittener, wenn auch Du ganzheitlich trainieren und dich lieben lernen möchtest, dann bist du hier genau richtig!
Bei Interesse für Probetermine oder neue Anfängerkurse schreibe und gerne eine E-Mail an: polecreationstudio@gmail.com.
Besuch uns auch gerne auf unserer Homepage:
www.polecreation.de",0,5.0,18 Rezensionen, polecreationstudio@gmail.com,http://www.polecreation.de,0,https://www.eversports.de/s/PoleCreation,2023-05-12 20:51:13
146,Stadtgazellen Bremen,28217,Bremerhavener Straße 210 , 28217 Bremen,"Dein Studio für Poledance und Luftakrobatik in Bremen! In unserem wunderschönen Studio mit Loftcharakter bieten wir euch Pole Dance und Aerial Fitness Kurse auf höchstem Niveau. Unsere professionell ausgebildeten Trainer unterrichten euch in Kleingruppen um ein gesundheitsorientiertes, qualitativ hochwertiges Fitness- und Tanztraining mit viel Spaß zu bieten. Jedem Teilnehmer steht ein eigenes Luftakrobatikgerät zur Verfügung. Auf 300qm Fläche findet ihr zwei Kursräume und einen großzügigen Umkleidebereich mit Kaffeeküche und Lounge. Ausreichend kostenlose Parkplätze stehen euch um das Studio herum zur Verfügung.",0,4.9,70 Rezensionen, info@poledance-bremen.de,http://www.poledance-bremen.de,+4915154033605,https://www.eversports.de/s/Stadtgazellen-Bremen,2023-05-12 20:51:13
147,a heart for poledance,51469,Nußbaumer Straße 6, 51469 Bergisch Gladbach,"Diese Sportanlage bietet eine Vielzahl an Sportarten an. Sieh dir das breite Angebot der Anlage an, wie z.B. Sportplätze, Klassen, Trainings, Workshops, Camps, etc. Finde weitere Informationen wie Bewertungen, Standort, Preise, Lehrer:innen und Trainer:innen, sowie FAQs weiter unten.",0,0.0,(Noch keine Bewertungen), info@aheartforpoledance.de,0,+4915735519129,https://www.eversports.de/s/a-heart-for-poledance,2023-05-12 20:51:14
148,Pole Werk by Nelly,66450,Kleinottweilerstraße 75 , 66450 Bexbach,"Das Pole Werk ist das erste Poledance und Aerial Hoop Studio im Saarpfalz-Kreis. Von Kinderkursen, Pole Dance, Aerial Hoop und Flexibility ist alles dabei. Probier es aus und lass dich von diesen wunderschönen Sportarten verzaubern.",0,5.0,22 Rezensionen, polewerk@t-online.de,0,+49 15174417744,https://www.eversports.de/s/Pole-Werk-by-Nelly,2023-05-12 20:51:14
149,PoleFitness Leipzig,4103,Salomonstraße 18B , 04103 Leipzig,"Du suchst ein ansprechendes Krafttraining? Du willst Spaß und einen stählernen Körper?
Wir zeigen dir, wie du deinen Körper effektiv trainierst und dabei in ungeahnte Höhen aufsteigst!
Unser Studio mit über 4,70 Meter hohen Stangen bietet genug Spielraum für erste Schritte, stetiges Training und den Übergang in den Performance-Bereich. Unsere erfolgreichen Trainerinnen nehmen deine individuellen Ziele in die Hand und bringen sie für dich in greifbare Nähe.",0,4.9,10 Rezensionen, info@polefitness-leipzig.de,https://polefitness-leipzig.de/,+49 1629269299,https://www.eversports.de/s/PoleFitness-Leipzig,2023-05-12 20:51:20
150,BALANCE Neumarkt,92318,Deininger Weg 94 , 92318 Neumarkt in der Oberpfalz,"BALANCE Neumarkt ist ein Kursstudio mit einem sehr breiten Online- und Studioprogramm. Es befindet sich in Neumarkt in der Oberpfalz, unweit von der Bushaltestelle Regensburger Straße. Angeboten werden Tanzkurse (Jazz Dance, Dance Kids, Streedance & Funky Jazz), Poledance, Yoga, Pilates, Sings und vieles mehr. Bei BALANCE Neumarkt werden sowohl regelmäßige Klassen als auch aufbauende Kurse und einmalige Workshops angeboten. Seit 2020 steht allen Kunden eine Online-Videothek zur Verfügung. Videos können einzeln gekauft oder mit dem entsprechenden Service erworben werden.",0,4.9,92 Rezensionen, studio@balance-neumarkt.de,http://www.balance-neumarkt.de,+49 160 80 20 246,https://www.eversports.de/s/BALANCE-Neumarkt,2023-05-12 20:51:20
151,Yoga and Pole Art by Selina,53783,Zum Wingert 10 , 53783 Eitorf,"Yoga and Pole Art by Selina bietet dir Online Live Klassen (inkl. 24h Aufzeichnungen), Intensivkurse, Workshops und Personal Training in folgenden Bereichen an:
· Hatha Yoga
· Vinyasa Yoga
· Yoga Rad (auch bekannt als Yoga Wheel) für Einsteiger und Fortgeschrittene
· Aerial Yoga
· Pole Trick Training
· Spinning Pole Combos Einsteiger
· Spinning Pole Combos Intermediate
· Splits on Pole Intermediate
· Flexi Pole Tricks
· Krafttraining und Trainingsperiodisierung
· Krafttraining an der Stange
Zudem bietet dir Yoga and Pole Art by Selina zahlreiche Aufzeichnungen und Video Kurse im Pole Sport und Yoga Bereich.",0,5.0,49 Rezensionen, yogaandpoleartbyselina@gmail.com,http://www.yogaandpoleartbyselina.com,+49 15738925807,https://www.eversports.de/s/Yoga-and-Pole-Art-by-Selina,2023-05-12 20:51:22
