65,BodySoul Studio Düsseldorf,40599,Süllenstraße 30, 40599 Düsseldorf,"Hallo und herzlich willkommen im BodySoul Studio Düsseldorf,
Im Angebot stehen sowohl Präsenz- als auch Onlinekurse & 1:1 Coaching zur Verfügung.
Hierbei wird der Fokus sowohl auf den Körper als auch auf den Geist gelegt.
Flexibility/ Stretching/ Mobility
Fullbody Powerstretching: Umfangreiches und ausgiebiges Dehnprogramm mit Kräftigungs- & Stabilitätsübungen für den Aufbau einer validen Beweglichkeit und dem Zusammenspiel von Yogaflowsequenzen. Hier findest Du ein qualitatives Programm für den Spagat, Vor- & Rückbeuge. Es werden nicht nur Basics trainiert, sondern auch anspruchsvolle Einheiten, sodass du herausgefordert wirst und eine Entwicklung garantiert ist.
Yoga & Meditation
Durch Hatha Yoga sorgen wir dafür, dass die Verbindung zwischen Körper und Geist zustande gebracht wird, um im Leben besser mit Stresssituationen umgehen zu können und generell eine Gelassenheit zu kultivieren.
Je nach Kurs können dabei sanfte flows, Powervinyasa oder auch kraftvolles akrobatisches Ashtanga Yoga vorkommen mit einer anschließenden entspannenden Savasana-session für den Geist am Ende der Stunde.
Zirkeltraining/ Akrobatik
Acrobatics preparation: Im Vordergrund steht in diesem Kurs der Aufbau von Kraft und Stabilität durch intensive Übungen, die alle Bereiche abdecken (Ausdauer, Kraft, Beweglichkeit). Ein schöner Nebeneffekt von meinem Programm ist die Körperspannung, die sich nebenher entwickelt. Sehr hilfreich z.B. für den Unterarm- oder Kopfstand. Also kommen hier auch akrobatische Elemente und die dazugehörigen Vorübungen vor (Handstandtraining).
1:1 Coaching
In den Bereichen der yogischen Lebensphilosophie (Selbstheilung, Mindset, Persönlichkeitsentwicklung), Meditation/ Atemtechniken, Achtsamkeits- & Bewusstseinsarbeit, sowie auch Personaltraining (inkl. Mentaltraining), kann solch eine Stunde gerne gebucht werden. Dafür darfst du dich gerne bei mir telefonisch oder per Nachricht melden
Alle Kurse sind für jedes Level geeignet, da individuelle Anforderungen in der Klasse gestellt werden.",0,4.9,13 Rezensionen, info@bodysoul-studio.com,http://bodysoul-studio.com/,+49 15906354338,https://www.eversports.de/s/bodysoul-studio-duesseldorf,2023-05-12 15:56:47
66,Pole Werk by Nelly,66450,Kleinottweilerstraße 75 , 66450 Bexbach,"Das Pole Werk ist das erste Poledance und Aerial Hoop Studio im Saarpfalz-Kreis. Von Kinderkursen, Pole Dance, Aerial Hoop und Flexibility ist alles dabei. Probier es aus und lass dich von diesen wunderschönen Sportarten verzaubern.",0,5.0,22 Rezensionen, polewerk@t-online.de,0,+49 15174417744,https://www.eversports.de/s/pole-werk-by-nelly,2023-05-12 15:56:48
67,a heart for poledance,51469,Nußbaumer Straße 6, 51469 Bergisch Gladbach,"Diese Sportanlage bietet eine Vielzahl an Sportarten an. Sieh dir das breite Angebot der Anlage an, wie z.B. Sportplätze, Klassen, Trainings, Workshops, Camps, etc. Finde weitere Informationen wie Bewertungen, Standort, Preise, Lehrer:innen und Trainer:innen, sowie FAQs weiter unten.",0,0.0,(Noch keine Bewertungen), info@aheartforpoledance.de,0,+4915735519129,https://www.eversports.de/s/a-heart-for-poledance,2023-05-12 15:56:48
68,UpsideDown Studio Bad Homburg,61348,Louisenstraße 98 , 61348 Bad Homburg vor der Höhe,"Das Studio UpsideDown ist in Bad Homburg vor der Höhe zu finden. Interessierte können Aerial Hoop (Luftkünste), Poledance, Stretch und Relax trainieren. Für Freiluftenthusiasten ist ein Outdoor-Training, eine Kombination aus Kraft und Ausdauer, möglich. Aerial Hoop wird in luftiger Höhe praktiziert und kommt einem Flug durch die Lüfte sehr nahe. Im Studio UpsideDown können Neueinsteiger ihre Fitness auf akrobatische Weise auf die Probe stellen.",0,5.0,18 Rezensionen, info@upsidedown-studio.de,https://www.upsidedown-studio.de/,+491724519252,https://www.eversports.de/s/upsidedown-studio-bad-homburg,2023-05-12 15:56:49
69,Dance & Pole Langenfeld,40764,Kölner Straße 16 , 40764 Langenfeld (Rheinland),"Wir sind ein kleines, sehr persönliches Studio mit einer großen Auswahl an Kursangeboten.
Dance & Pole in Langenfeld ist ein Studio, in dem Tanz und Leidenschaft mit der Stange eins werden.
Das Angebot ist umfangreich, komm einfach mal vorbei und lass dich von uns inspirieren.",0,0.0,(Noch keine Bewertungen), info@danceandpole.de,https://www.danceandpole.de/,+49 1741929037,https://www.eversports.de/s/dance-and-pole-langenfeld,2023-05-12 15:56:50
70,Pole Land,40227,Kölner Straße 336A , 40227 Düsseldorf,"Pole Dance ist eine Sportart, die sinnlichen Tanz mit akrobatischen Elementen, Akzenten aus dem Ballett, Kraft- und Ausdauersport kombiniert.
Durch die Auseinandersetzung mit dem Sport und dem Bestreben, immer komplexere Figuren zu beherrschen, lernt man an seine Grenzen zu kommen, diese zu überwinden und sich immer wieder neuen Herausforderungen zu stellen. Diese Philosophie nehmen die Teilnehmerinnen auch mit in den Alltag. Pole Dance stärkt so neben dem Selbstbewusstsein auch das eigene Körpergefühl und die Ausstrahlung.
Es gibt kaum einen Muskel, der bei diesem Training nicht zum Einsatz kommt. Die Teilnehmerinnen entwickeln eine sehr gute Körperspannung und -Beherrschung, die man schon bald an ihrer Haltung erkennen kann. Die Kraftübungen werden mit Tanzschritten zu Choreografien zusammengesetzt, die immer wieder geübt werden, bis sie fließend ausgetanzt werden können. Ziel ist es, die Figuren und Schritte leicht und unbeschwert wirken zu lassen. Die Trainerinnen unterstützen hierbei, geben Tipps und Hilfestellungen – und so stellen sich auch die ersten Erfolgserlebnisse ein.
Alle Trainerinnen bei Pole Land haben eine zertifizierte Pole Dance Ausbildung abgeschlossen. Die Teilnehmerinnen trainieren stets unter professioneller Anleitung.",0,4.9,57 Rezensionen, info@poleland.de,https://www.poleland.de,+49 15737270967,https://www.eversports.de/s/pole-land,2023-05-12 15:56:51
71,POLEDANCE NRW,40237,Rethelstraße 28 Hof , 40237 Düsseldorf,"Unser über 500 Quadratmeter großes Studio mit zwei Trainingsräumen bietet beste Trainingsvoraussetzungen speziell für Pole Dance und weitere Sportarten wie Tanz, Yoga oder Pilates.
Große Fensterfronten fangen tagsüber den Sonnenschein ein, abends erzeugt die indirekte Beleuchtung ein angenehmes Licht während die Fußbodenheizung an kalten Tagen für die optimale Wohlfühl-Temperatur sorgt.
Der weite Abstand zwischen den Stangen lässt genug Bewegungsfreiheit zu, so dass Du Deinen gesamtem Bewegungsradius nutzen kannst, die große Spiegelfläche gibt Dir visuell direktes Feedback über Deine Bewegungsausführungen, was Deine Trainings-Fortschritte noch mehr fördert indem es den Lernprozess beschleunigt!",0,4.9,42 Rezensionen, office@poledance.nrw,https://www.poledance.nrw,+49 1721010400,https://www.eversports.de/s/poledance-nrw,2023-05-12 15:56:52
72,OLD Kaifu-Lodge,20144,Bundesstraße 107, 20144 Hamburg,"In der Kaifu-Lodge werden Kurse zu den Themen Kraftsport, Cadio, Schwimmen, Squash, Athletik, Eltern/Kind- und Outdoorsport angeboten. Die Sportanlage befindet sich im Herzen von Eimsbüttel und ist nicht weit von den Bushaltestellen ""Christuskirche"", ""Kaiser-Friedrich Ufer"" und ""Schlump"" entfernt. Parkplätze sowie ein Parkhaus befinden sich in unmittelbarer Nähe. Das Studio verfügt über 3000 qm² Fitnessfläche, sowie den größten Yoga & Pilatesbereich in Hamburg. Zudem gibt es je einen Pool im Innen- und Außenbereich und eine Gastronomie.",0,0.0,(Noch keine Bewertungen), info@kaifu-lodge.de,http://www.kaifu-lodge.de,+49 40 401281,https://www.eversports.de/s/kaifu-lodge,2023-05-12 15:56:52
73,Flow Academy,89077,Pfarrer-Weiß-Weg 16, 89077 Ulm,Dein Studio für Poledance und Flexibility.,0,5.0,2 Rezensionen, info@flowacademy-ulm.de,0,+49 15165181566,https://www.eversports.de/s/flow-academy,2023-05-12 15:56:52
74,LOFT1 BASEL CITY,4051,Centralbahnplatz 10 , 4051 Basel,"Hell und freundlich und mit 13 Stangen ausgestattet, präsentiert sich das neue Loft1- Studio im gewohnten Stil, direkt am Bahnhof von Basel.
Ein kleiner Balkon, die hohe Decke und der Blick auf den Bahnhofsplatz machen dieses Studio zu etwas besonderem.
Im Loft1 Basel City werden folgende Kurse angeboten: Polefitness, Aerial Hoop und Stretching
Weitere Angebote sind: Schnupperlektionen, Privatstunden, Workshops und Polterevents.
Loft1 steht für Qualität. Unser Ziel ist es dass sich unsere Kunden in den Loft1 Studios wohl fühlen und gemeinsam mit uns ihre Ziele erreichen. Dabei ist der Spass - Faktor im Vordergrund.
Unser Motto: Fitness muss Freude machen.
In den Loft1 Studios herscht eine schöne und unkomplizierte Atmosphäre. Alle Frauen egal in welchem Alter sind bei uns herzlich willkommen!",0,4.7,27 Rezensionen, info@loft1.ch,https://www.loft1.ch/studio-basel-2-2/,0,https://www.eversports.de/s/loft1-basel-city,2023-05-12 15:56:53
75,Poledancestar,4317,Gabelsbergerstraße 1A , 04317 Leipzig,"Poledancestar bedeutet Kompetenz, Zusammenhalt, Spaß, Flexibilität. In Vielen Kursen mit und ohne Pole bekommst du eine optimale Mischung, um Dich vorranzubringen - sportlich und mental. Kinder ab 4 Jahre trainieren bei Poledancestar und nach oben sind keine Grenzen gesetzt. Schnupperstunden, Basickurse, Poletricks & -transitions, Wettkampfvorbereitung/Choreografieerstellung, Privattraining, Pole-Party, Twerken, Exotic Pole, Rent your Pole, Poledance Kids & Teens,Fit for Pole, Flexibility, Poledancestar*-Instructor",0,4.9,51 Rezensionen, info@poledancestar.de,http://poledancestar.de,+4917621887999,https://www.eversports.de/s/poledancestar,2023-05-12 15:56:53
76,Aerial Studio,3565,Mississippidreef 2, 3565 CG Utrecht,"Diese Sportanlage bietet eine Vielzahl an Sportarten an. Sieh dir das breite Angebot der Anlage an, wie z.B. Sportplätze, Klassen, Trainings, Workshops, Camps, etc. Finde weitere Informationen wie Bewertungen, Standort, Preise, Lehrer:innen und Trainer:innen, sowie FAQs weiter unten.",0,4.8,16 Rezensionen, info@aerial-studio.nl,https://www.aerial-studio.nl,+31 628209884,https://www.eversports.de/s/aerial-studio,2023-05-12 15:56:54
77,Pole Plus,86156,Ulmer Straße 152 , 86156 Augsburg,"Pole-Dance ist so viel mehr als ein Tanz an der Stange.
Ursprünglich kommt Pole-Dance aus dem chinesischen Zirkus und wurde nur von Männern ausgeübt, der akrobatische Aspekt ist demnach definitiv nicht zu vernachlässigen.
Wir möchten dir im Pole Plus zeigen, was die absolute Trendsportart alles zu bieten hat.
Denn genau wegen seiner Vielseitigkeit erfreut sich der Pole-Sport so einer großen Beliebtheit und fasziniert einfach jeden.
Das Training setzt sich zusammen aus einem Aufwärm-Programm, dem Pole-Training und einem Cool-Down.
Wir trainieren verschiedene Figuren, Posen, Kombinationen, akrobatische Elemente und auch Choreografien.
Du benötigst für unsere Anfängerkurse keinerlei Vorkenntnisse und auch kein spezielles Fitness-Level.
Wir freuen uns auf dich!",0,4.9,5 Rezensionen, info@pole-plus.com,http://www.pole-plus.com,+49 15776626728,https://www.eversports.de/s/pole-plus,2023-05-12 15:56:55
78,Center of Moving Arts,64625,Fabrikstraße 21, 64625 Bensheim,"Das Center of Moving Arts liegt 100m entfernt vom Edeka Jakobi Center in Bensheim.
Das Studio hat 3 Tanzräume und eine gemütliche Bar mit über 700qm. Liebevoll eingerichtet mit einer Lounge erwartet dich ein Tanzzentrum mit Stil und Charme im ""Industrial - Look"". Du kannst frei nach belieben Kurse wie Pole-Dance, Aerial Hoop, Hip Hop / New Style / Millennium Classes / Videoclip, Jazz / Modern / Contemporary, Bungee Dance und Yoga buchen. Die ausnahmslos professionell ausgebildete Dance-Coaches sorgen in jedem Style für Energie, Niveau und Spaß.
Du erreichst das Center of Moving Arts zu Fuß in 10min vom Hauptbahnhof und hast direkt vor unserem Center Parkmöglichkeiten.",0,4.9,18 Rezensionen, info@center-of-moving-arts.de,http://www.center-of-moving-arts.de,+4962519447196,https://www.eversports.de/s/center-of-moving-arts,2023-05-12 15:56:56
79,Freaky-Fitness,88250,Danziger Straße 3 , 88250 Weingarten,"Freaky-Fitness ist ein Kursstudio in Weingarten (Ravensburg). Der Schwerpunkt der Studios liegt auf dem Polesport, welcher sowohl für Anfänger als auch für Fortgeschrittene und Profis angeboten wird. Mittlerweile beinhaltet das Kursprogramm auch viele ergänzende Kurse rund um das Thema Poledance und Pole Sport, wie Power Pole, Pole Splits, Heels Dance, Splits uvm. Weiterhin wird auch eine Körperzusammensetzungsanalyse vom weltweiten Marktführer Inbody angeboten um dadurch das Training spezieller und zielführender zu planen.
Bei uns gibt es kein wetteifern, es wird als Team trainiert und jeder freut sich über die Erfolge des Stangennachbarn. Dies schafft ein unglaublich angenehmes Trainingsklima, in welchem jeder auf seinem Level arbeiten kann. Wir teilen unser Wissen extrem gerne und sehen es als unsere Aufgabe an, Dich in deiner Entwicklung zu fördern.",0,4.9,44 Rezensionen, info@freaky-fitness.de,https://freaky-fitness.de/,+49 15126920078,https://www.eversports.de/s/freaky-fitness,2023-05-12 15:56:56
80,Studio AERIS,3511,Westerkade 10 , 3511 HA Utrecht,"Studio AERIS offers a boutique fitness experience with pole, aerial and dance classes. Feel free to join a pole technique class, exotic pole, aerial hoop, aerial hammock, twerk and more.
The studio is located at the Westerkade 10, close to the Utrecht city centre and Vaartsche Rijn station.
Classes for Everybody - Professional Instructors - Top Rated on Google
Read more on www.studio-aeris.com",0,4.9,37 Rezensionen, info@studio-aeris.com,http://www.studio-aeris.com,+31 621446117,https://www.eversports.de/s/studio-aeris,2023-05-12 15:56:57
81,Pole Statement,69123,Siemensstraße 40 , 69123 Heidelberg,"Bei Pole Statement unterrichten wir Pole Dance in unterschiedlichen Leveln und orientieren uns immer an den persönlichen Zielen und Bedürfnissen unserer Teilnehmerinnen. Unsere Trainerinnen unterrichten mit viel Herz, Freude und Professionalität. Wir lieben Pole Dance und freuen uns, dass wir unsere Leidenschaft an unsere TeilnehmerInnen weitergeben, voneinander lernen, uns gegenseitig inspirieren und gemeinsam über uns hinauswachsen können.
Neben Pole Dance bieten wir auch weitere Fitnesskurse wie Jumping Fitness und twerXout an. Es wird also nie langweilig!",0,5.0,22 Rezensionen, info@polestatement.de,http://www.polestatement.de,+49 17672506814,https://www.eversports.de/s/pole-statement,2023-05-12 15:56:58
82,PoleCreation,87435,Immenstädter Straße 11 , 87435 Kempten (Allgäu),"Du bist neu hier? Melde dich bitte ausschließlich vorab per Mail!
polecreatinstudio@gmail.com
Herzlich Willkommen bei PoleCreation! Lerne dich selbst zu kreieren!
Dein Studio in Kempten für Poledance, Fitness, Flexi und Akrobatik!​
Dich erwartet in stets freundlicher und motivierender Atmosphäre ein Training ohne Druck.
Egal ob Anfänger oder Fortgeschrittener, wenn auch Du ganzheitlich trainieren und dich lieben lernen möchtest, dann bist du hier genau richtig!
Bei Interesse für Probetermine oder neue Anfängerkurse schreibe und gerne eine E-Mail an: polecreationstudio@gmail.com.
Besuch uns auch gerne auf unserer Homepage:
www.polecreation.de",0,5.0,18 Rezensionen, polecreationstudio@gmail.com,http://www.polecreation.de,0,https://www.eversports.de/s/polecreation,2023-05-12 15:56:59
83,Soul Flight,10969,Lobeckstraße 36, 10969 Berlin,"Pole Dance ist ein Tanz, welcher Kraft, Eleganz und Schönheit verbindet. Er steht für die Verschmelzung von Verführung und Akrobatik. Im Poledance Studio Soul Flight, erlernst du diese ästhetische Trainingsmethode nicht nur genauer kennen, sondern trainierst zugleich deinen ganzen Körper, straffst diesen und wirst so Stück für Stück flexibler. Soul Flight bietet neben hochmotivierten Trainern, professionellen Trainingsgeräten und jeder Menge Platz zur freien Entfaltung auch hippe beats und lässt dich den Alltagsstress vergessen. Ausgestattet ist das Studio mit 2 Poledanceräumen, sowie 4,50 m hohen Wettkampfstangen, die zu 100% aus Edelstahl bestehen. Verankert sind diese mit fünf 12er Schrauben, sowohl oben als auch unten und stehen dir für dein Training zur Verfügung.",0,4.8,5 Rezensionen, info@soulflight.de,http://www.soulflight.de,+49 17656888299,https://www.eversports.de/s/soul-flight,2023-05-12 15:56:59
84,Passionate Pole & Sports,73230,Schöllkopfstraße 40 , 73230 Kirchheim unter Teck,"Wir bieten dir im Passionate Pole & Sports ein vielseitiges Kursangebot. Ob Pole Dance Kurse, Stretching, Akrobatik oder Conditioning, es ist für alle was dabei. Mit jeder Menge Spaß wirst du in unseren Kursen ganz nebenbei Kraft aufbauen, deine Beweglichkeit, Ausdauer und dein Körpergefühl fördern und verbessern. Komm vorbei, lerne uns kennen und entdecke die vielseitige Welt des Pole Sports. Bei uns wird jede/r mit offenen Armen empfangen.",0,5.0,23 Rezensionen, info@passionatepolesports.de,https://www.passionatepolesports.de,0,https://www.eversports.de/s/passionate-pole-and-sports,2023-05-12 15:57:00
85,YOGA at Lobe Block,13357,Böttgerstraße 16 , 13357 Berlin,"Yoga Makes Us Happy
Rooftop Yogastudio in Berlin YOGA at Lobe Block ist ein mit viel Liebe und Klarheit geschaffener Ort. Wir sind das einzige Out- und Indoor Studio Berlins mit privater Outdoor Fläche und Rooftop. Bei uns liegt der Fokus auf einer breiten Auswahl an Yoga Stilen und Behandlungen.
Lehrer und Therapeuten mit vielfältigen Erfahrungen und Schwerpunkten teilen kreativ und mit Herzblut ihre Leidenschaft mit dir. Zeitgemäßes Yoga, gesundheitliche Ausrichtung des Körpers und Geistes, Offenheit und Flexibilität im Geiste, eine Prise Kreativität und kein bisschen Eso-Feeling.
Unser Studio rund um Yoga, Meditation, Massagen und anderen Behandlungen ermöglicht dir, deine Balance zu stärken. Wir bieten 30+ Online- & Outdoor Klassen pro Woche an — Hatha, Vinyasa, Jivamukti, Yin & Restorative, Strala, Forrest & Specials wie Yoga & Music & Gong Meditation. Alle Klassen finden in einem unserer Studioräume oder auf den (Dach)Terrassen statt. Bleib du selbst mit uns im YOGA at Lobe Block!
YOGA at Lobe Block is a centre with two studios for movement and wellbeing creating unique classes, workshops and treatments for you.",0,4.8,115 Rezensionen, yoga@makesmehappy.de,http://lobe.yoga,0,https://www.eversports.de/s/yoga-at-lobe-block,2023-05-12 15:57:01
86,SWISS MEGA PARK,4402,Schützenstrasse 2, 4402 Frenkendorf,"Der SWISS MEGA PARK in Frenkendorf ist nicht nur Sportpark, sondern auch Freizeitpark mit einem vielfältigen In- und Outdoorangebot. Im Sportpark kannst du Tennis, Badminton, Squash, Padel, Indoor Fußball, Bubble Soccer, Minigolf und Fitness ausüben. Im Funpark stehen Abenteuer wie Megajump, ein Kletterpark, Kidsfun, Lasertag und Ferienangebote zur Verfügung. Euren Magen könnt ihr mit einem ""Börger to go"" aus dem Börger Star verwöhnen.",0,4.5,12 Rezensionen, kontakt@swissmegapark.ch,http://www.swissmegapark.ch/,+41 61 901 76 64,https://www.eversports.de/s/swiss-mega-park,2023-05-12 15:57:02
87,Tanzschule Poledance Reutlingen,72793,Uhlandstraße 60 , 72793 Pfullingen,"Die Tanzschule Poledance Reutlingen befindet sich in der Uhlandstraße 60 in 72793 Reutlingen- Pfullingen. Wir bieten Kurse in Poledance, Aerial Silk und Aerial Hoop an. Außerdem gibt es Conditioning Kurse wie Stretching, freies Training und Handstand. Komm bitte 10 min. vor Unterrichtsbeginn damit du dich in Ruhe umziehen und noch eventuelle Fragen klären kannst. Ziehe Sportkleidung an und bringe ein Handtuch für deine Matte mit, für die Poledance Kurse brauchst du eine kurze Hose. Du kannst direkt vor dem Haus, an der Straße kostenlos parken, ca. 10 Minuten zu Fuß befindet sich außerdem eine Bushaltestelle.
Komm vorbei- wir freuen uns auf dich!",0,4.9,39 Rezensionen, info@poledance-reutlingen.de,https://www.poledance-reutlingen.de,0,https://www.eversports.de/s/tanzschule-poledance-reutlingen,2023-05-12 15:57:03
88,Pole Dance Krefeld,47809,Hochfelder Straße 47, 47809 Krefeld,"Das Studio Pole Dance Krefeld findet ihr in Krefeld Oppum direkt neben dem Bahnhof Krefeld Oppum. Trainiert wird in einem lichtdurchfluteten 200m² großen Raum auf ca 140m² Tanzfläche. Der Raum verfügt über 14m Spiegelwand und über 4m hohe Decken. Im Sommer sorgt eine Klimaanlage für ein angenehmes Training. Das Kursangebot umfasst Pole Dance, Exotic Pole Dance, Kids Pole, Bungee Fit & Jump und Workshops für Chair Dance, Lap Dance, Floorwork und Aerial Hoop. Wenn gerade nicht getanzt wird, versammeln wir uns im gemütlichen Lounge Bereich. Öffentliche Parkplätze am Straßenrand.",0,4.9,86 Rezensionen, info@poledancekrefeld.de,https://www.poledancekrefeld.de,+4917623943247,https://www.eversports.de/s/pole-dance-krefeld,2023-05-12 15:57:03
89,Firstsports - Polefitness,39112,Halberstädter Straße 17 , 39112 Magdeburg,"Herzlich Willkommen bei Firstsports Polefitness aus Magdeburg.
Im Herzen von Magdeburg findest Du hier das einzige, tägliche Angebot an Polefitness- und Aerialsportarten der Stadt. Die liebevollen und hochmotivierten Trainerinnen begeistern Dich für ganz besondere Sportarten. Sie legen viel Wert auf individuelle Betreuung und qualitative Trainings, vor allem mit Spaß und einer Menge Lerneffekten. Die Teilnehmerinnen schätzen besonders die persönliche Atmosphäre und die herzliche Betreuung durch das Trainerteam.
Du kommst ganz bequem mit den öffentlichen Verkehrsmitteln sowie Fahrrad oder Auto zum Firstsports - Polefitness Studio.",0,4.9,38 Rezensionen, polefitness@firstsports.de,http://www.firstsports-polefitness.de,+4917660163383,https://www.eversports.de/s/firstsports-polefitness,2023-05-12 15:57:04
90,Sportheim Abensberg,93326,Von-Hazzi-Straße 7, 93326 Abensberg,"Das Sportheim Abensberg befindet sich in der Abensberger Altstadt und bietet seit 2009 Gruppenfitnesskurse auf höchstem Niveau für alle Levels. Frauen & Männer sind gleichermaßen willkommen. Trainiert wird in familiärer Atmosphäre mit professionellen Trainern, das sorgt für effizientes Training mit Funfaktor. Langhanteltraining, Core-Training, funktionelles Training, TRX, deepWORK, bodyART, POUND und Zumba sorgen für Abwechslung im Training.
Für alle Tanz- und Akrobatikfans hat das Sportheim Abensberg unter auch Poledance und Aerial Hoop im Angebot.",0,4.9,36 Rezensionen, office@sportheim.net,http://www.sportheim.net,0176-24621998,https://www.eversports.de/s/sportheim-abensberg,2023-05-12 15:57:04
91,Poledance-Area,42853,Mandtstraße 2 , 42853 Remscheid,"Diese Sportanlage bietet eine Vielzahl an Sportarten an. Sieh dir das breite Angebot der Anlage an, wie z.B. Sportplätze, Klassen, Trainings, Workshops, Camps, etc. Finde weitere Informationen wie Bewertungen, Standort, Preise, Lehrer:innen und Trainer:innen, sowie FAQs weiter unten.",0,4.4,1 Rezensionen, info@poledance-area.de,http://www.poledance-area.de,+49 01623675667,https://www.eversports.de/s/poledance-area,2023-05-12 15:57:05
92,Infinity Polesports Eggenfelden,84307,Landshuter Straße 65, 84307 Eggenfelden,"Infinity Polesports Eggenfelden ist das erste Sportstudio für Poledance in Eggenfelden beziehungsweise im Landkreis Altötting. Es gibt zwei Studios, eines in Burgkirchen und das zweite in Eggenfelden. Du kannst in den neuen und top-ausgestatteten Studios verschiedene Kurse buchen, vom Einsteigerkurs bis zum Profikurs, aber auch Exotic Pole für sexy Moves oder Pole + für ein besonders intensives Training werden angeboten.",0,4.9,11 Rezensionen, info@infinity-polesports.de,https://www.infinity-polesports.de,+431721642077,https://www.eversports.de/s/infinity-polesports-eggenfelden,2023-05-12 15:57:05
93,Da Becca Flow and Fit,44651,Eickeler Markt 3A , 44651 Herne,"Für Neukunden-bitte eine Email bei Interesse an unseren Kursen an info@dabecca.de .
Da Becca Flow and Fit - wir heissen Dich herzlich willkommen in unserem wunderschönen Pole/Floorwork/ Tanzstudio. Hier wird wert auf persönliche und kleine Lerngruppen gelegt und Dir ein Safespace für Frauen mit professioneller Betreuung geboten. Trainingserfolge mit Spass , viel Musik, Tanzen und auch schweisstreibenden Stretching und Choreos. Mal sensual, mal rockig , mal contemporary . Wir haben Dir im kleinen rahmen viel zu bieten . Wir freuen uns auf das Tanzerlebnis mit Dir oder auch in unseren Mobility Kursen mit Dir an Deiner flexibilität und Kraft zu arbeiten !!!
Wir arbeiten mit Flatrates und 10 und 5 er Karten daher seid euch bitte im klaren das nicht immer gewährleistet ist das ihr euren Wunschkurs jede Woche belegen könnt dafür aber bis zu 80 Kurse im Monat zur Auswahl habt !!",0,5.0,21 Rezensionen, info@dabecca-flowandfit.de,http://www.dabecca-flowandfit.de,+49 17620913644,https://www.eversports.de/s/da-becca-flow-and-fit,2023-05-12 15:57:06
